{
  "$schema": "../../../../schemas/adapters/research-result.schema.json",
  "id": "pixco-ef-nz",
  "subject": {
    "manufacturerId": "pixco",
    "brandId": "pixco",
    "name": "Canon EF to Nikon Z Adapter"
  },
  "reviewedOn": "2026-09-04",
  "decision": {
    "status": "included",
    "recordId": "pixco-ef-nz"
  },
  "sources": [
    {
      "url": "https://pixco.com.cn/products/ef-nikon-z-adapter",
      "publisherRelationship": "manufacturer-or-brand",
      "sourceType": "product-page",
      "checked": [
        "identity",
        "lifecycle",
        "mountConfigurations",
        "electronics",
        "conversionOptics",
        "mechanisms",
        "officialProductPages"
      ]
    },
    {
      "url": "https://pixco.com.cn/collections/adapter-for-nikon-z",
      "publisherRelationship": "manufacturer-or-brand",
      "sourceType": "collection",
      "checked": [
        "identity",
        "mountConfigurations"
      ],
      "decisionChecks": [
        "availability"
      ]
    }
  ]
}
