{
  "$schema": "../../../../schemas/adapters/research-result.schema.json",
  "id": "kipon-om-nik-z-m",
  "subject": {
    "manufacturerId": "kipon",
    "brandId": "kipon",
    "name": "OM-NIK Z M with Helicoid"
  },
  "reviewedOn": "2026-09-02",
  "decision": {
    "status": "included",
    "recordId": "kipon-om-nik-z-m"
  },
  "sources": [
    {
      "url": "https://www.kipon.jp/products/om-nik-z-m-with-helicoid",
      "publisherRelationship": "manufacturer-or-brand",
      "sourceType": "product-page",
      "checked": [
        "identity",
        "lifecycle",
        "mountConfigurations",
        "electronics",
        "conversionOptics",
        "mechanisms",
        "officialProductPages"
      ],
      "decisionChecks": [
        "availability"
      ]
    }
  ]
}
