{
  "$schema": "../../../../schemas/adapters/research-result.schema.json",
  "id": "fotodiox-ef-nkz-dlxs",
  "subject": {
    "manufacturerId": "fotodiox",
    "brandId": "fotodiox",
    "name": "Fotodiox DLX Stretch Lens Adapter - Compatible with Canon EOS (EF / EF-S) D/SLR Lens to Nikon Z-Mount Mirrorless Cameras with Macro Focusing Helicoid and Magnetic Drop-In Filters"
  },
  "reviewedOn": "2026-09-04",
  "decision": {
    "status": "included",
    "recordId": "fotodiox-ef-nkz-dlxs"
  },
  "sources": [
    {
      "url": "https://fotodioxpro.com/products/ef-nkz-dlxs",
      "publisherRelationship": "manufacturer-or-brand",
      "sourceType": "product-page",
      "checked": [
        "identity",
        "lifecycle",
        "mountConfigurations",
        "electronics",
        "conversionOptics",
        "mechanisms",
        "officialProductPages"
      ],
      "decisionChecks": [
        "availability"
      ]
    }
  ]
}
