{
  "$schema": "../../../../schemas/adapters/research-result.schema.json",
  "id": "kippertie-zeiss-nano-prime-z-mounts-individual",
  "subject": {
    "manufacturerId": "kippertie",
    "brandId": "kippertie",
    "name": "Zeiss Nano Prime Z mounts – individual focal lengths"
  },
  "reviewedOn": "2026-09-19",
  "decision": {
    "status": "excluded",
    "reason": "Excluded because each product replaces a lens's rear mount; it is not an interposed mount adapter."
  },
  "sources": [
    {
      "url": "https://store.kippertie.com/product/zeiss-nano-prime-z-mounts-individual-focal-lengths/",
      "publisherRelationship": "manufacturer-or-brand",
      "sourceType": "product-page",
      "checked": [
        "identity",
        "mountConfigurations",
        "physical.dimensionMeasurements"
      ]
    }
  ]
}
