{
  "$schema": "../../../../schemas/adapters/research-result.schema.json",
  "id": "big-421248",
  "subject": {
    "manufacturerId": "brenner-import",
    "brandId": "big",
    "name": "B.I.G. Objektivadapter Hasselblad V an Nikon Z"
  },
  "reviewedOn": "2026-09-19",
  "decision": {
    "status": "included",
    "recordId": "big-421248"
  },
  "sources": [
    {
      "url": "https://www.big-photo.de/b.i.g.-objektivadapter-hasselblad-v-an-nikon-z",
      "publisherRelationship": "manufacturer-or-brand",
      "sourceType": "product-page",
      "checked": [
        "identity",
        "mountConfigurations",
        "electronics",
        "conversionOptics",
        "mechanisms",
        "officialProductPages"
      ],
      "decisionChecks": [
        "availability"
      ]
    },
    {
      "url": "https://www.big-photo.de/pdf/archiv/big-katalog/BIG_2021_2.pdf",
      "publisherRelationship": "manufacturer-or-brand",
      "sourceType": "catalog",
      "checked": [
        "identity",
        "lifecycle",
        "mountConfigurations"
      ],
      "decisionChecks": [
        "availability",
        "release-status"
      ]
    },
    {
      "url": "https://www.big-photo.de/thumbnail/58/c6/d0/1770904931/421248a-a01_800x800.jpg?ts=1770969150",
      "publisherRelationship": "manufacturer-or-brand",
      "sourceType": "image",
      "checked": [
        "identity"
      ]
    },
    {
      "url": "https://www.big-photo.de/pdf/archiv/big-katalog/BIG-GESAMTKATALOG.pdf",
      "publisherRelationship": "manufacturer-or-brand",
      "sourceType": "catalog",
      "checked": [
        "identity",
        "mountConfigurations",
        "electronics"
      ]
    }
  ]
}
