{
  "$schema": "../../../../schemas/adapters/research-result.schema.json",
  "id": "hartblei-sra-i",
  "subject": {
    "manufacturerId": "hartblei",
    "brandId": "hartblei",
    "name": "HARTBLEI SRA-I Superrotator Adapter Interchangeable"
  },
  "reviewedOn": "2026-09-19",
  "decision": {
    "status": "included",
    "recordId": "hartblei-sra-i"
  },
  "sources": [
    {
      "url": "https://www.hartblei.de/en/whatsnew.htm",
      "publisherRelationship": "manufacturer-or-brand",
      "sourceType": "announcement",
      "checked": [
        "identity",
        "identity.modelNumberOptions",
        "lifecycle",
        "mountConfigurations",
        "electronics",
        "conversionOptics",
        "mechanisms",
        "physical.tripodSupport"
      ],
      "decisionChecks": [
        "availability",
        "release-status"
      ]
    }
  ],
  "notes": [
    "Three independent 360-degree rotations are specified for the Superrotator assembly."
  ],
  "unresolved": [
    "Can Nikon Z-specific rear and four-sided product photographs establish the complete exterior? The official listing offers Nikon Z, but the inspected photographs show another camera-mount configuration or do not identify the rear mount."
  ]
}
