{
  "$schema": "../../../../schemas/adapters/research-result.schema.json",
  "id": "big-421249",
  "subject": {
    "manufacturerId": "brenner-import",
    "brandId": "big",
    "name": "B.I.G. Objektivadapter Mamiya 645 an Nikon Z"
  },
  "reviewedOn": "2026-09-19",
  "decision": {
    "status": "included",
    "recordId": "big-421249"
  },
  "sources": [
    {
      "url": "https://www.big-photo.de/pdf/archiv/big-katalog/BIG_2021_2.pdf",
      "publisherRelationship": "manufacturer-or-brand",
      "sourceType": "catalog",
      "checked": [
        "identity",
        "lifecycle",
        "mountConfigurations",
        "electronics",
        "conversionOptics",
        "mechanisms"
      ],
      "decisionChecks": [
        "availability",
        "release-status"
      ]
    }
  ],
  "unresolved": [
    "Can exact Nikon Z front, rear and four-sided product images or a product-specific manual confirm the electronic-contact, optical-path and mechanism details?"
  ]
}
