{
  "$schema": "../../../../schemas/adapters/research-result.schema.json",
  "id": "haoge-lm-z",
  "subject": {
    "manufacturerId": "haoge",
    "brandId": "haoge",
    "name": "Leica M to Nikon Z Manual Lens Mount Adapter"
  },
  "reviewedOn": "2026-09-19",
  "decision": {
    "status": "included",
    "recordId": "haoge-lm-z"
  },
  "sources": [
    {
      "url": "https://haogefoto.com/products/haoge-manual-lens-mount-adapter-for-leica-m-lm-zeiss-zm-voigtlander-vm-lens-to-nikon-z-mount-camera-such-as-z6-z7",
      "publisherRelationship": "manufacturer-or-brand",
      "sourceType": "product-page",
      "checked": [
        "identity",
        "identity.modelNumberOptions",
        "lifecycle",
        "officialProductPages",
        "mountConfigurations",
        "electronics",
        "conversionOptics",
        "mechanisms"
      ]
    },
    {
      "url": "https://haogefoto.com/collections/adapter-for-nikon-z-mount-camera",
      "publisherRelationship": "manufacturer-or-brand",
      "sourceType": "catalog",
      "checked": [
        "identity",
        "mountConfigurations"
      ],
      "decisionChecks": [
        "availability"
      ]
    },
    {
      "url": "https://cdn.shopify.com/s/files/1/0593/2403/9326/files/92605f438f17b2917df79cc220d5d9f2.jpg?v=1686997010",
      "publisherRelationship": "manufacturer-or-brand",
      "sourceType": "image",
      "checked": [
        "identity.modelNumberOptions",
        "mountConfigurations",
        "electronics",
        "conversionOptics"
      ]
    },
    {
      "url": "https://cdn.shopify.com/s/files/1/0593/2403/9326/files/083c8f92fb4cca14f6914da877ae2b38.jpg?v=1686997014",
      "publisherRelationship": "manufacturer-or-brand",
      "sourceType": "image",
      "checked": [
        "identity.modelNumberOptions",
        "mountConfigurations",
        "electronics",
        "conversionOptics"
      ]
    }
  ]
}
